강자가 약자를 괴롭혔어요,The strong bullied the weak
실패에 실을 감았어,I wound thread onto a spool
안전벨트 착용의 의무화,mandatory seat belt use
멀리 바다가 뵈는 집,a house with the sea visible in the distance
덩치가 우람한 사내,a burly man
이마에 손을 얹어,I place my hand on my forehead
신문의 하단에다 광고를 실었어,I placed an ad at the bottom of the newspaper
회복 불능인 상태,an irrecoverable state
구청에 민원을 내,I file a complaint with the district office
바다가 막막하게 펼쳐져 있었어,The sea stretched out endlessly
운세가 크게 떨쳐요,Good fortune flourishes greatly
남의 돈을 넘봤어요,I coveted someone else's money
어머니의 은혜에 보답합니다,I repay my mother's kindness
장래가 유망한 청년,a promising young man
담벼락에 포스터를 붙여,I put up a poster on the wall
새 길이 널찍하게 뚫려,A new road opens up wide
고전적 수업 방식,a classical teaching method
앞으로 무슨 일을 할 작정인가?,What do you plan to do from now on?
그의 의견에 찬성합니다,I agree with his opinion
아차 깜박 잊었네,Oh I completely forgot.
하반기 결산 보고,second-half financial report
위험한 시점에 도달했어,I reached a dangerous point
선생님 말씀에 순종해,I obey the teacher's words
남쪽 방면으로 여행했습니다,I traveled toward the south
사건의 이송을 받았어요,I received the transfer of the case
이 길은 고속 도로와 이어졌어,This road connected to the highway
원활한 사회 적응,smooth social adaptation
그의 직책은 명목뿐인 이사였어,His position was only a nominal directorship
부채를 쫙쫙 폈어요,I spread the fan wide
뺨을 찰싹 갈겨요,I slap the cheek
적병들이 우리를 쫓아와요,Enemy soldiers are chasing us
마음을 굳게 다잡아요,I steel my mind
활동에 불편리한 복장,clothes inconvenient for activity
과일 상자를 깔고 앉았습니다,I sat on a fruit box
친구에게 수영을 배웠어,I learned swimming from a friend
제품의 장단점을 조사했어,I investigated the product's pros and cons
음흉한 미소를 지어,I wear a sly smile
급박한 상황 변화,a sudden urgent change in the situation
대장장이가 농기구를 만들어,The blacksmith makes farm tools
그는 익은 떡이었습니다,He was a sure thing
차원이 낮은 영화,a low-brow movie
다른 사람의 꿈을 비웃지 마,Don't mock other people's dreams.
우리별 1호 발사,Launch of Our Star 1
친구를 자기 동아리에 끌어들여요,I draw my friend into my club
이 동네는 교통이 편리했습니다,Transportation in this neighborhood was convenient
하늘의 조화가 절묘했어,The harmony of the sky was exquisite
자유주의 헌법 정신,the liberal spirit of the constitution
낚싯밥에 걸려든 붕어,a crucian carp caught by bait
뽀얗게 흙먼지가 일어,A pale dust cloud rises
친구와 역 앞 다방에서 만났어,I met a friend at the cafe in front of the station
문제의 본질을 포착했어,I grasped the essence of the problem
집안에 걱정이 사라져요,Worries at home disappear
냉혹한 현실에 부딪혀,I run into harsh reality
그들은 무척 가난했어요,They were very poor
가까스로 웃음을 참았어,I barely held back my laughter
수사 기관의 검증,verification by investigative authorities
눈부신 활약을 해,I put on a dazzling performance
할머니는 편안하게 임종을 하고 계세요,Grandmother is passing away peacefully
그쪽 일은 어떻게 됐습니까?,How did that matter on your end turn out?
책을 또박또박 읽어,I read the book clearly
김장독을 비닐로 둘러쌌어요,I wrapped the kimchi jar with plastic
관련 책임자의 사퇴를 요구합니다,We demand the resignation of the responsible person
농담으로 하는 말,something said as a joke
그는 휴일 아침마다 늦잠을 잤어요,He slept in late every holiday morning
당정을 면밀히 살피고 있어,I'm closely examining the ruling party and the government
온건파와 개혁파의 충돌,a clash between moderates and reformists
돌무더기가 와르르 무너져요,The pile of rocks collapses with a crash
질문에 합당한 답변,an answer appropriate to the question
왕복으로 세 시간 걸리는 거리,a distance that takes three hours round trip
양파를 밭에 심었습니다,I planted onions in the field
폭우로 한 치 앞이 안 보입니다,I can't see an inch ahead because of the downpour
할머니에게 아이를 업혀 보내고 있어,I'm sending the child to Grandma on someone's back
냉전 사상의 주입,indoctrination of Cold War ideology
봉건 사회의 성립,the establishment of a feudal society
사무실 임대 보증금 오천만 원,50 million won office lease deposit
선교 활동을 펼쳤어요,I carried out missionary activities
바다와 하늘이 맞닿은 수평선,the horizon where sea and sky meet
온몸이 꽁꽁 얼었어,My whole body froze stiff
사전 구속 영장 발부,issuance of a pretrial detention warrant
고 녀석 참 야무지게 생겼군,That kid looks really sharp.
중식으로 김밥을 준비합니다,I prepare gimbap for lunch
무력에 의한 침략,aggression by force
정치적 중립성을 회복해요,I restore political neutrality
전쟁터에서 폭발탄에 맞아 죽었어,I got hit by an explosive shell on the battlefield and died
초가삼간 외딴 오두막,a solitary thatched hut
마약은 사회에서 소멸돼야 했어,Drugs had to be eradicated from society
갱에 들어가는 광부들,miners entering the pit
5년 이하의 징역형에 처했어,I was sentenced to up to five years in prison
동굴 속에서 살았습니다,I lived in a cave
점심시간에 도시락을 먹고 있어,I'm eating a lunchbox at lunchtime
찹쌀가루를 따뜻한 물로 반죽해요,I knead glutinous rice flour with warm water
탄소 배출을 줄이기 위한 노력,efforts to reduce carbon emissions
육체적 쾌락만을 추구하는 세태,a trend of pursuing only physical pleasure
거품을 걷어내고 있어,I'm skimming off the foam
흔히 일어나는 사건,a commonly occurring incident
나이보다 숙성한 아이,a child mature beyond their age
실습 위주의 교육,practice-oriented education
말하는 태도가 세련돼 있습니다,The speaking style is refined
형편없는 위인 같으니라고,What a pathetic so-called great man.
묵묵히 짐을 꾸리고 있어,I'm quietly packing my stuff
피리를 빼빼 불었습니다,I blew the flute shrilly
학교에서 왕따가 됩니다,I become an outcast at school
고무가 달린 연필,a pencil with an eraser
추수가 한창인 논,a rice paddy in the middle of harvest
중학생을 위한 전 과목 학습지,all-subject study worksheets for middle schoolers
변소에 구더기가 들끓어,Maggots are swarming in the toilet
내 말을 즉각 시행하라,Carry out my orders immediately.
매일 똑같은 생활,the same routine every day
표창으로 짐승을 잡아요,I catch the animal with a harpoon
땀 흘려 지은 농작,crops raised with sweat and toil
천둥이 우는 소리,the rumble of thunder
티끌이 들어갔는지 눈이 껄끄러웠어,My eye felt gritty as if dust got in
마음가짐을 굳게 했습니다,I steeled my resolve
청약 예금 가입자,a housing subscription savings account subscriber
열 살 남짓해 보이는 소년,a boy who looks about ten
이제 어지간히 해라,That's enough now.
매상이 곱이나 올라요,Sales rise severalfold
현실과 비현실을 넘나드는 작품,a work that moves between reality and unreality
음식 솜씨가 쏠쏠했어,My cooking skills were pretty good
포도가 탱글탱글 익어 있었어요,The grapes were plump and ripe
땀에 젖은 옷을 쥐어짜요,I wring out the sweat-soaked clothes
억세게 재수가 없었어요,I was really unlucky
그는 굳은 신념을 지닌 사람이었습니다,He was a person with firm convictions
웬만한 사람은 다 아는 일,something most people know
최전방 공격수로 나섰어,I stepped up as the front-line striker
섬세한 장면 묘사,delicate scene description
절도로 귀양살이를 가요,I go into exile for theft
악당과 결전을 벌여요,I fight a decisive battle with the villain
본디부터 타고난 성품,an innate character
지대한 영향을 끼쳤어요,It had a huge influence
부러운 눈빛으로 쳐다봤어요,I looked with envious eyes
할아버지의 유물을 정리합니다,I organize my grandfather's relics
과일의 썩은 부분을 도려냈어,I cut out the rotten parts of the fruit
펜으로 선을 작 그었어요,I drew a small line with a pen
자존심이 상하는 일,something that hurts one's pride
총탄 세례를 받았어요,I came under a hail of bullets
팔을 붕대로 휘감아요,I wrap my arm with a bandage
이 약은 진통 효과가 탁월해요,This medicine has excellent pain relief
색종이를 오려서 만든 꽃,a flower made by cutting colored paper
불의에 찾아온 재난,a sudden unexpected disaster
어려운 문제를 지혜롭게 해결해,I solve difficult problems wisely
제발 살려 주세요,Please save me.
집안의 법도를 따라요,I follow the family's rules
회의에서 거론된 문제를 해결해,I solve the issues raised in the meeting
하늘로 날아오르는 비행기,an airplane soaring into the sky
목적과 수단의 전도 현상,a reversal of ends and means
비록 가난했지만 행복했어,Though I was poor I was happy
적성에 맞는 일을 해,I do work that suits my aptitude
그는 세계적인 마술사예요,He is a world-class magician
먼지를 툭툭 털어요,I shake off the dust
그 이론이 정설로 인정돼,That theory is recognized as the accepted view
외부 세계와 단절돼요,I'm cut off from the outside world
내전에 외국 군대가 개입했어요,Foreign troops intervened in the civil war
산 정상에 올라 목청껏 소리쳐요,I climb to the summit and shout at the top of my voice
회사를 후계자에게 넘겨줘,I hand the company over to the successor
정부의 보조금을 받은 사업,a project that received government subsidies
일석이조의 효과를 거두었습니다,I achieved a two-birds-with-one-stone effect
빗으로 머리를 빗습니다,I comb my hair with a comb
무소속 국회 의원,an independent National Assembly member
웃는 모습이 섹시해,The smile looks sexy
허리가 구부러진 노파,an old woman with a bent back
대문에 태극기를 내걸어,I hang the Taegeukgi on the front gate
아따 말도 많네,Gee you sure talk a lot.
오징어를 구워 먹었어요,I grilled and ate squid
에그 저게 뭐야!,Oh what's that!
파도가 바위를 때려요,Waves hit the rocks
그가 우승 후보로 유력합니다,He is a strong contender for the title
공범 여부를 조사합니다,I investigate whether there is an accomplice
노동에 의한 소득,income from labor
나 지금 정말 졸려,I'm really sleepy right now.
우정이 적의로 돌변했어,Friendship turned into hostility
초창기의 신선함을 잃어요,I lose the freshness of the early days
서류를 박박 찢었어,Tore the documents to shreds
학술 논문 등재 기준,criteria for listing academic papers
졸업을 한 달 앞둬,Graduation is a month away
찬성과 반대를 분명히 했어,Made support and opposition clear
기획안이 사장에게 제출됐어,The proposal was submitted to the boss
내리막길을 따라 내려갔어요,Went down along the downhill road
직접적인 연관이 닿습니다,There is a direct connection
조사를 확실히 했어,Carried out the investigation thoroughly
강둑에 토사가 쌓여,Sediment builds up on the riverbank
얼굴에 홍조를 띠어요,There's a flush on the face
트럭 두 대 분량,the equivalent of two truckloads
탁발한 기억력의 소유자,a person with a remarkable memory
그럼 어떻게 하지?,Then what should we do?
누나는 재작년 여름에 시집간 상태입니다,My older sister got married the summer before last
흰 물결이 밀려오는 바닷가,a seashore where white waves roll in
남녀 차별을 없애,Get rid of gender discrimination
으응 이제 한결 나아,Mm-hm I feel a lot better now.
공사로 차량의 통행을 금지해요,Vehicle traffic is prohibited due to construction
낙동강 중류 연안,the middle reaches of the Nakdong River
그들은 서로를 외면하고 지나갔어,They passed by ignoring each other
마당에 국화가 한창이에요,The chrysanthemums are in full bloom in the yard
손이 못에 긁혀 찢어져,A hand gets scraped and torn on a nail
닭과 오리는 같은 부류에 속했습니다,Chickens and ducks belonged to the same category
변함없는 충성을 바쳤어,Offered unwavering loyalty
아뇨 그럴 리가 없어요,No that can't be.
녹음기로 녹음을 합니다,Record with a recorder
티끌이 들어가서 눈이 따가웠어요,My eye stung because a speck got in it
허름한 양복을 한 벌 구입합니다,Buy a shabby suit
국군에게 포착된 공비,a guerrilla captured by the ROK army
기계식 주차장을 설치했어요,Installed a mechanical parking garage
친구와 정담을 주고받습니다,Have a heart-to-heart with a friend
저것을 좀 보십시오,Please take a look at that.
문을 딸까닥 열었어요,Opened the door with a click
제도적 장치를 마련해,Set up institutional measures
적진에 포탄을 퍼부었어,Rained artillery shells on the enemy positions
외환 보유를 허용해,Allow foreign currency holdings
나 역시 마찬가지였어,I was the same too
어떠한 자극도 없는 무료한 일상,a dull daily life with no stimulation
경제 분야의 전문가,an expert in the field of economics
그거 좀 가져와 봐,Bring that here.
둘 사이는 친형제처럼 긴밀했어요,The two were as close as real brothers
엥 내가 왜 그랬지?,Huh why did I do that?
부모 형제 없이 고단한 처지,a hard lot without parents or siblings
그의 발상은 기발하고 참신했어요,His idea was ingenious and fresh
아이스크림을 혀로 핥아요,Lick the ice cream with your tongue
허리선이 강조된 옷,clothes that emphasize the waistline
뒤끝이 영 개운치 않아,The lingering feeling doesn't feel right
옷자락이 문틈에 끼었어,The hem got caught in the door crack
그는 또래보다 성숙했어요,He was more mature than his peers
슬기로 빛나는 눈,eyes shining with wisdom
시큼한 김치 냄새,the sour smell of kimchi
고소를 금치 못했어요,Couldn't help but file a complaint
저택의 객실에 묵어,Stay in the guest room of the mansion
컵에 물을 따랐어요,Poured water into the cup
친구를 집으로 초대했어,Invited a friend home
자석이 쇠붙이를 끌어당겼어,A magnet pulled the metal pieces
흥미 위주의 오락물,entertainment focused on excitement
빙긋 미소를 띠고 있어,Wear a faint smile
위험한 사상에 마취가 됐어요,Was numbed by dangerous ideas
고기압의 가장자리에 들었어,Entered the edge of the high-pressure system
황량하고 을씨년스러운 풍경,a desolate bleak scene
기미 독립 선언서,the Gimi Declaration of Independence
정부에 땅을 팔아,Sell the land to the government
후회 없는 삶을 살아,Live a life without regrets
수사를 맡은 형사,the detective in charge of the investigation
차바퀴가 진흙탕에 빠졌어요,The car wheel got stuck in the mud
그는 회사에서 쫓겨났어요,He was kicked out of the company
원고의 소송을 기각해요,Dismiss the plaintiff's lawsuit
이불을 탈탈 털어요,Shake out the blanket
시골의 장날 풍경,the scene on a market day in the countryside
그따위 말버릇을 어디서 배웠니?,Where did you learn to talk like that?
공장을 현지에 설립해요,Establish a factory locally
거울 속에 비친 얼굴,a face reflected in the mirror
내 최애 음료는 커피였어,My favorite drink was coffee
여론의 질타를 받아요,Receive public criticism
논의의 필요성을 느꼈어,Felt the need for discussion
바보 취급을 당해,Get treated like a fool
학교 창립 30주년 기념식,the school's 30th anniversary ceremony
그는 시속 물정에 밝았어요,He was well aware of worldly affairs
그는 콧수염이 잘 어울렸어요,He looked good with a mustache
머리 모양이 바뀌었습니다,The hairstyle changed
방 안에서 어둠을 몰아냈어,Drove the darkness out of the room
강아지가 꼬리를 살랑살랑 흔들어요,The puppy gently wags its tail
진솔한 대화를 나눠,Have an honest conversation
굵직하게 새끼를 꼬았습니다,Twisted a thick straw rope
야생 동물의 왕국,the kingdom of wild animals
입사 시험 탈락자,an applicant who failed the hiring exam
자신의 주장을 합리화합니다,Rationalize one's argument
밤낮 놀기만 해요,Do nothing but play day and night
눈에 이물이 들어갔어요,A foreign object got into my eye
어려움을 함께한 친구,a friend who shared hardships
대사관에 가서 비자를 신청해요,Go to the embassy and apply for a visa
콩나물을 시루에 앉혔어,Placed the bean sprouts in the steamer
흑인의 권익을 위해 활동합니다,Work for the rights of Black people
추위에 입술이 헤어졌어,My lips split from the cold
알약을 빻아 가루로 만들어요,Crush the pill into powder
답안지에 학번을 적었습니다,Wrote my student number on the answer sheet
음식이 상당히 남아 있어요,There's quite a lot of food left
논에 물을 가둬요,Hold water in the rice paddy
기득권을 갖고 있어,Have vested interests
그래그래 내가 정말 잘못했어,Okay okay I was really wrong.
지극히 담담한 표현,an extremely matter-of-fact expression
고무줄로 머리를 묶었어요,Tied my hair with a rubber band
조국의 운명을 걸머져요,Shoulder the fate of the homeland
고향 생각이 났어,I thought of my hometown
장독 뚜껑을 열어,I open the lid of the sauce jar
물병에 물을 담아 둬요,I keep water in the bottle
이 늙은이가 무얼 알겠습니까?,What would this old man know?
추첨을 통하여 학교를 배정받았습니다,A school was assigned by lottery
그는 병역을 마친 뒤 취업합니다,He gets a job after completing his military service
집값이 큰 폭으로 하락했어요,Housing prices fell sharply
공연은 벌써 후반부에 접어들었어요,The performance had already entered the second half
무보다 문을 중시해,I value learning over martial arts
따가운 여름 햇살,the scorching summer sun
유명 선수들에게 열광하는 관중,spectators who go wild for famous players
전일 빌린 돈을 오늘 갚았습니다,I repaid today the money I borrowed the day before
그는 문을 비집고 들어왔어요,He squeezed through the door
공원에 개똥이 많아,There is a lot of dog poop in the park
영원한 사랑이란 환상에 불과했어,Eternal love was just an illusion
곳곳에 많은 연구소가 생겨났어요,Many research institutes sprang up everywhere
황금은 부를 상징하는 대명사입니다,Gold is synonymous with wealth
과일을 넣은 빙수,bingsu with fruit
이 일부터 우선 해결하자,Let's deal with this first.
고졸 또는 동등의 학력,a high school diploma or equivalent education
소금의 강한 탈수 효과,salt's strong dehydrating effect
각종 규모의 공장 시설,factory facilities of various sizes
일 년을 공백으로 보내,I take a year off
정세를 살핀 후에 결정할 일이었어요,It was something to decide after checking the situation
현상금 500만 원을 내걸었어요,A reward of five million won was offered
아차 우산을 놓고 왔구나!,Oh I left my umbrella behind!
차갑게 식은 커피,coffee gone cold
이 약은 복용이 간편해요,This medicine is easy to take
여러 번 녹음을 했습니다,I recorded it several times
경찰서에 도난 신고를 해,I report the theft to the police station
그때 그 시절의 추억이 아련합니다,Memories of those days are faint
의로운 일에 자기를 희생했습니다,I sacrificed myself for a righteous cause
동생 그동안 잘 지냈나?,Little brother have you been well?
생후 8개월 된 아기,an eight-month-old baby
이 책은 관외 대출이 안 됩니다,This book cannot be borrowed outside the district
어린이는 나라의 새싹이었어요,Children were the nation's sprouts
손쉬운 해결 방법,an easy solution
그는 유럽 각국을 여행했어,He traveled around various European countries
벽에서 못이 뽑혀요,A nail comes out of the wall
처리해야 할 업무가 산더미 같아요,There is a mountain of work to handle
얼굴이 누렇게 되었습니다,My face turned yellowish
그녀는 탐나는 신붓감이에요,She is a desirable bride
수도권 개발 권역을 설정해,I designate the capital region development area
월척에 가까운 붕어,a crucian carp nearly a trophy catch
그는 인권의 파수꾼이었어,He was a guardian of human rights
국회 의원 보좌관,a National Assembly member's aide
그냥 주는 거니?,Are you just giving it to me?
출발 시간의 지연,a delay in departure time
그녀의 나이는 서른 언저리였습니다,Her age was around thirty
가난한 자에게 동정을 베풀었습니다,I showed compassion to the poor
욕먹을 짓을 했어요,I did something that got me cursed at
숨을 깊이 들이마셔,I take a deep breath in
올 들어 첫눈이었습니다,It was the first snow of the year
간장과 설탕으로 고기를 조미해요,I season the meat with soy sauce and sugar
문장 성분의 생략,Omission of sentence elements
매사에 정확을 기해,I strive for accuracy in everything
살점을 베어 냈어요,I cut off a piece of flesh
대양으로 밀려가는 물결,Waves surging toward the ocean
후속 조치가 따랐어,Follow-up measures followed
부엌에서 식사를 준비했습니다,I prepared a meal in the kitchen
버려진 아이를 양자로 삼았어요,I adopted the abandoned child
걸레로 마루를 빡 문대,I scrub the floor hard with a rag
학식과 덕망을 갖추었습니다,I possessed learning and virtue
거래 업체에 부품을 조급해,I supply parts to the business partner
각 나라의 국가를 연주했어요,I played the national anthems of each country
아버님의 유명을 받들었어,I followed my father's last wish
상대 팀은 예상보다 훨씬 강합니다,The opposing team is much stronger than expected
이 지역의 주요 작물은 고추였어요,The main crop of this area was red chili peppers
인원을 적절히 배치했습니다,I assigned the personnel appropriately
실력을 충분히 발휘해,I fully demonstrate my ability
대학에 학과를 신설했습니다,I established a new department at the university
끔찍한 살인 사건,A terrible murder case
우리 민족 고유의 전통과 풍습,The traditions and customs unique to our people
방문을 닫고 다녀라,Close the door as you go
주문이 끊이지 않아,Orders never stop
정답을 알려 줘요,I tell you the correct answer
그 일이 있은 직후,Right after that happened
하수도 구멍이 메여요,The sewer hole gets clogged
민의를 국정에 반영합니다,I reflect public opinion in state affairs
튀김을 바삭하게 튀기는 방법,How to fry so it comes out crispy
좀이 쑤셔서 몸이 비비 틀려요,It itches and my body squirms
아랫배에 힘을 주고 말해,I speak while tightening my lower abdomen
큰 영예가 주어져요,A great honor is given
피의자를 검찰에 소환해,I summon the suspect to the prosecutor's office
별똥별을 보며 소원을 빌었어요,I made a wish while watching a shooting star
수레에 깔려 다쳤어,I was injured after being run over by a cart
사전 심의를 거쳤어,It went through prior review
경기가 무승부로 끝났어,The game ended in a draw
걸어오다가 뒤돌아 달려가,I walk over and then turn back and run
막다른 골목에 몰렸어요,I was cornered in a dead-end alley
오늘 저녁 후식은 수박입니다,Tonight's dessert is watermelon
작업자의 업무 환경을 개선했어,I improved the worker's working environment
근심으로 밤을 지새웠어요,I stayed up all night worrying
갑작스러운 사태에 대처했어요,I responded to the sudden situation
끝없는 갈등의 연속,A continuous string of endless conflicts
세세하게 일러 줘요,I explain it in detail
법정에서 무죄가 입증됐어,In court innocence was proven
확신에 찬 목소리,A voice full of conviction
공사가 막바지에 다다랐어,The construction reached the final stage
수입 확대에 대한 반작용,A backlash against import expansion
막말로 한마디만 더 할게요,I'll say just one more thing bluntly
이 문항은 어려워서 풀지 못해요,This question is difficult so I can't solve it
생명 창조의 신비,The mystery of the creation of life
입씨름 좀 그만둬라,Stop bickering already
평생을 두고 잊지 못할 일,Something you'll never forget for the rest of your life
벽장 안에 돈을 감춰요,I hide money in the closet
화려한 도회지 생활,A glamorous city life
유럽 연합 회원국,A member state of the European Union
이쪽으로 가까이 오너라,Come closer this way
벽난로에 불을 지펴,I light the fireplace
그들은 행사장 주변을 정리해요,They tidy up the area around the venue
소비자 보호 협회를 설립했어,I established the Consumer Protection Association
학장 취임식을 거행해,We hold the dean's inauguration ceremony
