콧물을 손등으로 쓱 닦아,A runny nose is wiped with the back of the hand
교통사고 목격자가 한 명도 없었습니다,There were no witnesses to the traffic accident
열악한 노동 조건,Poor working conditions
인류의 역사를 추적했어요,Human history was traced
미제로 남아 있는 문제,An unresolved case
문식이 뛰어난 문장,A well-written sentence
터무니없는 욕심을 버려,Unreasonable greed is given up
엉망진창으로 돌아가는 세상,A world running in utter chaos
수업에 필요한 물품,Supplies needed for class
중국의 정통 요리를 맛봐요,Authentic Chinese cuisine is tasted
그들에게 공통된 것은 성실성이었어,What they had in common was sincerity
다른 부서로 옮겨요,A transfer to another department is made
학교 근처도 못 가 봤어,It was impossible to even go near the school
앞바퀴 구동 형식,Front-wheel drive type
성전을 짓고 봉헌 예배를 했어,A sanctuary was built and a dedication service was held
전염병 예방을 위해 방역해요,Disinfection is done to prevent infectious diseases
그녀는 피부색이 유난히 하얘,Her complexion is unusually fair
북소리가 둥둥 울렸어요,The drumbeats boomed
부역에 농민을 동원합니다,Farmers are mobilized for corvee labor
도망가는 도둑의 팔을 부여잡았어,The fleeing thief's arm was grabbed
올해는 김장이 흉년이라 걱정이었어요,It was worrying because this year's kimchi harvest was poor
굶주린 배를 채워요,A hungry stomach is filled
병색 어린 창백한 피부,Pale skin with a sickly look
불판에 삼겹살을 구워 먹었어요,Pork belly was grilled and eaten on a grill
흰 눈이 펄펄 내려요,White snow falls in flurries
